{
  "agent_id": "to9YFOnP-2_Ra2ANTvUG-NIJai3WR1oopaAW97t29-w",
  "agent_keys": {
    "es256": "BCyaWcc3rMd1f4yruiK983Ob40RL8l3bh3zBYS_1seTzKu1a9xRNo0ernK3YSCtXFNcPRFO3espqk1LeYO7qHu8",
    "ml-dsa-65": "LXsK6W2ilbkYQHGWD4dO8EGES7-fvJhGLp6_3iVW_aiE1CYrYsG-8MiGr1XR-osR0PjOJAW0i2ZLrezaB16fbRt_mxLnaSAL5NhEiUVwjkmcL-n1BRy8tLBjbPIKyrUSoN2oLkStMiiAwQbTDV8u_KFhLPQ7_AdSVJYrTX8iIn03YV_YN2oPC6V6Yg3DfZOxeAv3vub2EFupKLDYyq3vkRTHPo57S-mKImn0FTCT9kI6JV5743bxi_gaX1Xv7U27cVnSmF5MOiWW7dX124e-_-qYAVh9QSIdZhM6mA06XsmpKM_5His7bTjeo8cB3xQMsq8ecMKetUJL4C27X2pTpZ1Bt49tJ0S6e4oXXm4kGEW6Af5dg0IekeAl44pFvNn9_OgvZRgWuyzre825uo0PKgsMD4gmqiJFrC_xmUe4n7utVQ7k3A0zi_xPA8X2C_D9k4kbmqWg9cAQFPLjm-BofyH_FKZDsBRHwoFcrWORZno_9TjgrwOkSxY36Kh99_S86MQHmdFFL1MN_RfjQzqk7pcQ3Z_D6XiaP0VjS8m8br_Gu-ECPbNmirl2KbBuJJrzP8gYWjsGexEVfT7db0ww-D1w94-kD_VGf0gap9YIdLF2rRuzXbklfQpEtD1H3Bth_y_TMG50kdlHwXb51OBE_pBmciROGJDgVw5AMxjQwzOjctVj5n8P1YvqUE8uOkoURjQ0tsXlZoabV2xmall2Gp_1xOrtXaAkYQrQ4V1i6Ot5fEmXPu5rjpg4CxMHiqu-v2PwzlCQlUaObsRZ3OKydEzFD4sF9vaY1OVO8KMXifuJLIhw5siBFs56Zhn7vyOEuoCIOZTBTJc2EWKR4lCcUxK4-C_kVtvvBGO_TESysrUqo5OTZOBUjGQ37Zfw1uXqQEy5PVuF5rEJaPz_1ewn2OkaJ6JKDJ6HHzvAvS2N3U5nJhrlSfO4ZiAIrGZ4h1NDngulxpqk_d1xl6XW7h-Grst7Azxir4e8K7fDKsiCNRVpTYLWBAjDNN60FaZJMOYvkuyTEhG5tQi_cBvDPcfmrSJJzJQKcqajyL6Ao306m1rwGaV4eVKbOnFiQ3-Ib0G-Q3I9Ny7ccWIcMkqksiQlnnRapg3_1usPEAz9oap8o05cZfLcjZLJsm5J5mUbD3TWRXBAkeU_1XKZMEXfwmhEbN2SS6DDAz2PXo0sWYdyvUlu0RUKQQg78kSLq1xhrP8nwwRncMX1zDgpUItPIKK1hZ89jYHq8YRvHlYKnpAC3JPaTWBnU4FNPwoCViKSt05g-I6wbYXzv3kIAOd7HVK_bK__h0fmBfcimIPuCEXO08_3A00NTUtSE0yU8uLC5gnDZExi8tVbfHcogIK40VWt7l1PosMDepz2PoKCt6zlNy7lEDFtbiWnCmiwRcmBgIL2eVxa-0ARuCgJMwczpihcSXWGNeU36TDDPx_82mdDTb3c4Z4vtZXQdEji2t9-ObykSNXteH3OHiZjbGvpPdMffIpQ7FXv4NuOFdzQia0fhjRJRDri5l54WRxCLJ74iIe3LHfnpVUvSQ0YDWytYNojC5DdtFJLBrICd5gfqYuh_JHix1qlfLqEdgWXSaw1zgpVTT2n16OI9_jwnTLWE4kRxRXYMowLNFLvUJqq6sDLW_no9fRrZXOZYvcS2FsGWaoW2rvtxPv2Ph4X4N8m3ZUTZzLBM1Ipuuip_yBDQKtrqcEjqoNl77NdPta-_mJKbZzYdPHdd3lsDMZ1s2M6bHWLMmiQuzmAikleHH-KcyCDg0Tu2i_Wg9PpRTsWpff6Fcxg7suCD1WnklSa8fWsDeMJLQqbzCHuxhG1ZEj8HvjKyt4CZgnPqCChtdamzT_2dlN9P_b2RqGQ9FtEKq9c-me0HrQlByZbuFUYY1YoWvsiTtkOsh2aQ7b83YDl2MapCQfnsFCfQkgYHS1qDXD5IIi1KqIvnT2QrJq4pm79pzgcPfNrwV-X1TeJO0XjX8skrpaF2jiKXc3VYhHWscN0weT3a2DkIYWbd0UZKwMblRdx0SMXe2fflxKBObc04b74b53aQ3RBlkTNCrKeVkVXrw6XBiwVS0fRosvd7TlRRY3feDl6RCux2TrGHRYeZJSiCSO00vqrPmLZeCR_MFQ80BuAYePZX_ygdFy6igD8piA-5v2zOpUGS6fXr6AjEK13vbRRMtH9wTkBRIqQQT-r0DI5rFftxSbsUF7GWbFH4nOxYJ9ickBpefm3dC1xEBrsMZEKb3PViVs7nZ_gK9Z3Jgizc5x2Bt4BwW849RkH_-LMzdVm96g60E2dhoBZN9cI4_7C5lOsdBAggLxuzXoW-k8wKB8ZPz1M0rCWT0ixowHDkMzARhqPMlHBlHYvFQpQNxnFpSGy1VEIkz6vlRjFVx8Q56Gicd_tlHMo0fxYexpoT-NwlSOV6O5mCx7PC8sRYN_-l6H2nLhm_ZAus2q8QzklCB69HlT15evc4DymgL1G_gLh5JpYSyLKOjxlsgtc7juwma1H0ObOCK_pk_EQ7-4jSjU1ovtLF1JclSvexNFmDIxUeIu7m5OnYvmAD2x2r_wzrgzx-V52XifBrghFXCjt6TrN1xKfB-hAFDSXO1SNshg"
  },
  "agent_name": "contract-summariser",
  "delegation_id": "0192b3c4-5d6e-7f80-9a1b-0000000000d0",
  "hash": "67ad5aca823758e8f3f81402491d8b5fa70860aa6fe61181cdcf432b59e7bf45",
  "hash_alg": "sha-256",
  "not_after": "2026-10-16T12:00:00.000Z",
  "not_before": "2026-09-15T12:00:00.000Z",
  "principal_id": "9EUYhICIRQE0SZfiff6n61tje6a92I27MhknJyyFSUs",
  "principal_keys": {
    "es256": "BPdtLgmZq0HRzI-NDiO5hhnZUCDpwr8QNXyY25XvoIQexktL01ZGPhEZY4M-K4cevioTL19aDelLI5rg2P0RKJE",
    "ml-dsa-65": "vP0gzYbMt8SU6mdGUt6w0Y5nayZrKbvkk3QvisxoCjl__X7BYsK49q29D0EwyFmz8SMftHpeZ0uvnWWZwXqQ7xGicnKaxQ-b4W0FjM-hqAiEXJAuQtaTjo8gjJv7Zh3RgYl4_28tqVOCqBoQ1irUSYIXBd14mTfaVVOYxZICIQbiTjlTY0cbe-c_X2bS5qdGJqdf5llJSoAhZSUETmKTikSy9_UWyyJZ40ThfBJb8XVHVooKCnzavzPbmFBCZX1br0dCjpiyKRFvCKZOApVcB3gYC548vOTA4fM-Ic6PXr1HH8XI7DyY81-FCsxbqrQBNh48Qdrvumqws-a74B6rA5y21JJWteCKqHtZbycAcfL5CDr2sbCX1kZO4MnqSCJOg1ycHosRJrroNU7EjAGNEwvcTOLT8hXUZ9Bj-SFQ57_ptujZSic7x5DtIXPYLMjkdi6dsTSNHjnBoeMfPzivByaH8B3sSHl_1MLK7eqfL0BDFlwDZcRhx0USvdBTU90y_yiJeVQfpgIKWAq2r_UF_i3ihi6rGN5Q4daWPDnYV8Xym3LaZfGdss9U2o1P8w-AnMDsHVNXYIf7rPX-u2REWeYTP3HhrIE6ZIAEr6DkEa0-F-2PwBnLLGEsiCf6I2iBgiaOnU2AzRf1HrR6szvXXnFfJPKI83kEdIK8JVFUkGMhMfMcfO3LnHIzCBQR-tHW6wsbpNyZ4DGc8uIG3EMPtr5rHTczgige0u4SjKJkpW3RmPwImc3zG6aNM3rfDDDQ7hanHl2dXPRKHdUDGBGzpM7WelSwmmJodqzUUfKRm3SQWh6zXJVcnWLNb32u2AwkfoPFaMLBxN4U0umMB-wZShpKL4nIMA114f-uM6Fw6scA7A8j9n9NVMgW_8-04OZmjRoVLvaQhWmtXRwGupGINIcwgtAZrk5QZfn60artwO-jpttyIRegImwDEVBfJqnMP9LtC2vqgpoZFBaTKvzGqvwJqRDc7Sr7BE-lLmeiWzXqOEcu70JBxVm5YBHqdElqa2gd8byO4Lte4JdtaBa9oyOCmxP5BDWSJ_M_6Batiy7qjjeHIf4D7944Ho9TlS1cXs5usRx1qYXYdrIw0skWOee7lraaujdkZXxT8i-DvvXVkTl1Qe2mZfHPMuj4UoRmnRDyTCcBLDx86ORCPjoa1Obz9nhpVKCJGcOsVeCOJaW3OzxS-UQklwzeSQMov3uFQx0LVwZiuMXTJ9_exIyTqVEs6O0J-BAqec9z87mablQtcWBRDdO1tnEv8KUzLprVgX4zE-oRrwK9cfqLrzn6eNRhaPaDL7VQ78cmozcTyGjIcB2TfCgVhdBKJrA_aeYLOpxh5Aa_uPPCb8EX7V6CXCIKRSefTL72_TS_E4Q7mWdqcmD2YLdm0_dFqzZ7B0wIDlBhkt7vsiFS5LvujbA4ghw9gCYK5iJ79vc6YpuT7wbQJCqazluohpZbkZbsZV9sgGYGXU8kLCkWYzI3LXuaV5JixPglczP9bWdB0ntHlpowSBUNiw1OSB3AOXkAJm8mH3Z3RlZlehXq_baC79gTcU4GUaYOqEM5h4-5VpM_hmQ3RK9MZ8Aw49ZeFU6oyPXR-Wu9aA6_EdUqR1wBwfZkyoVk7JLRSPDImmRyZGcGrQfpBbyhzDvX2exCyy2iOrej3xAFVItXlezQsksRhi7BdHQ_1snEERivWBJZwbF_Twbaj5otMAoKNI8q0xgsnLWwmQQhjGzpEMW-XdmmaoTCbkGkQYdmjfddrxk7ruJWtaVsyt11Tcpm0d3iadE1Avf0rkEQ6_vnISZkqn4qzcUAfeO9y7SiNpzZVCrZnhCzPl3dRTx_wUSFRkMWtbUSZgTrCL_-W9RyxxRvM0KTc1AftzIijV3SfrptSPXUj2FtxJDER7vIHmGtFZMpqKd2p7wWQnHRNOE3XusbSvXy7kIOUYbw21pU-KZWsmYlpNJe6dxafGnqnSl2YNKjcjOunA0P83OU-Z2wWa7YCgOdZOHHIRheK-PbQ8W_cFaDriudXcYjAP0062yQgJi2AzwQ0Efvycid9GTMmITp0BdvDA_fkyHe-XnNkmzB6A0F3aff6Ix3pYzMrA7wEkzuLJL-mVgbBBmWUSE3ELW9-d3Qycp5zCsYjLM4wQsPmjRXfGP77a7vM4208pm958d3FabVPIYfEtRQu_HoFsF8vgFs20PnpMtT4QQDgNtg7_AgJC2tAb2mZa5DYh2YM5N34Fa4S1DsJbVU8o9BxuhtRIjet-tT_jslEQHXdpU-3WwuD4tT7LVHeq3CgQ5oCMKP0Dlz6MHs-9c7m38kNjL4lAR3qP6JLXymMSPY4KrUDM81moBj-IpnNQAW0Hd0bIz2o3C9e7Mzx8-O7EA58oMvCUB_r7m8dr_ez9uB0jUPmCmobr9vyBAjuifLMzaplAc3cqHVa8e_0ojvPRYSTrh2npoggcir21wwQl7ogVTTOMaCFwclqXWVPbu6RJ6gzsToMmJ45H0P6_St_vUzSLqCKdWzh0F8DmI0abHtnIsBeCH9rJhmK4rFWk-QxxAWc80lEHGSEHi5WWuRrZxu1T1RAW77zt3ddwNqYWRLGzLMxSnekU5jmt4"
  },
  "scope": {
    "allowed_locations": [
      "local",
      "cloud"
    ],
    "max_labels_to_cloud": [
      "public",
      "internal"
    ]
  },
  "signatures": {
    "es256": "tvW6F6wmBoU8UA_QP8w1IKeznrruKVznZ1W7CUpIDVCCeIGTOOhRz_Z-g3aeS0aA_nwX7PEYFCuav6cluvBTmw",